{
  "$schema": "http://json-schema.org/draft-07/schema#",
  "$id": "https://example.org/schemas/membership/user.added.schema.json",
  "title": "Membership User Added Payload",
  "description": "Payload schema for an event emitted when a user is added to a domain entity.",
  "type": "object",
  "additionalProperties": false,
  "required": [
    "resource",
    "user",
    "addedTimestamp"
  ],
  "properties": {
    "resource": {
      "type": "object",
      "additionalProperties": false,
      "required": [
        "kind",
        "id",
        "name"
      ],
      "properties": {
        "kind": {
          "type": "string",
          "minLength": 1,
          "description": "Kind of domain entity (for example organization, project, repository, or team-scope resource)."
        },
        "id": {
          "type": "string",
          "minLength": 1,
          "description": "Stable identifier of the domain entity."
        },
        "name": {
          "type": "string",
          "minLength": 1,
          "description": "Display name of the domain entity."
        }
      },
      "description": "Domain entity that received the new user membership."
    },
    "user": {
      "type": "object",
      "additionalProperties": false,
      "required": [
        "id"
      ],
      "properties": {
        "id": {
          "type": "string",
          "minLength": 1,
          "description": "Stable user identifier in the provider system."
        },
        "login": {
          "type": [
            "string",
            "null"
          ],
          "description": "Provider login or username."
        },
        "displayName": {
          "type": [
            "string",
            "null"
          ],
          "description": "Display name of the user."
        },
        "email": {
          "type": [
            "string",
            "null"
          ],
          "description": "Email address when available from the source system."
        }
      },
      "description": "User that was added."
    },
    "role": {
      "type": [
        "string",
        "null"
      ],
      "description": "Role assigned at the time of addition, if available."
    },
    "addedBy": {
      "type": [
        "string",
        "null"
      ],
      "description": "Actor or service principal that initiated the membership change."
    },
    "addedTimestamp": {
      "type": "string",
      "format": "date-time",
      "description": "RFC 3339 timestamp when the membership addition occurred."
    },
    "details": {
      "type": "object",
      "additionalProperties": true,
      "description": "Provider-specific metadata for this membership event."
    }
  }
}